{
  "schema_version": 1,
  "foreground_route_id": "foreground_route_legacy_chat_01",
  "revision": 1,
  "previous_revision": null,
  "conversation_id": "chat_legacy_demo",
  "route_epoch": 1,
  "surface_mode": "chat",
  "response_owner": "strong_primary",
  "status": "active",
  "activation_reason": "migration",
  "context_version": 0,
  "owner_claim_id": "foreground_claim_legacy_chat_01",
  "realtime_session_id": null,
  "realtime_session_generation": null,
  "supersedes_route_id": null,
  "superseded_by_route_id": null,
  "attached_task_ids": [],
  "created_at": "2025-12-01T09:00:00Z",
  "updated_at": "2026-08-02T13:00:00Z",
  "terminal_at": null
}
